{"coverage_ids":["cov-bank-s2","cov-chain-s2","cov-price-s2","cov-ta-s2"],"evaluation_clock":"2026-10-06T16:00:00Z","identity_link_ids":["link-0001"],"known_at":"2026-10-06T16:00:00Z","mapping_refs":["bank-redemption-frozen@1.0.0","pricing-frozen-synthetic@1.0.0","stellar-frozen-synthetic@1.0.0","ta-redemption-frozen@1.0.0"],"observation_ids":["obs-CN1","obs-PR1","obs-PS1","obs-RQ1"],"operation_ref":"RED-0001","profile_ref":"fund-redemption-synthetic@1.3.0","rules_ref":"redemption-synthetic-rules@1.3.0","schema_version":"1.0","snapshot_id":"snap-RD-CANCELLED","tenant_id":"tenant-synthetic-demo","valid_at":"2026-10-06T16:00:00Z"}